commit_hash	metric	vram	status	description
09df7a40da71d6168b5981239323290f63a12438	0.454147	0	DISCARD	[train] Val R² score: 0.454147 
09df7a40da71d6168b5981239323290f63a12438	0.360834	0	DISCARD	[train] Val R² score: 0.360834 
09df7a40da71d6168b5981239323290f63a12438	0.410035	0	KEEP	[train] Val R² score: 0.410035 
c15ae67dd97c53b8c4f5a2af4bb435b0b2712869	0.388067	0	DISCARD	[train] Val R² score: 0.388067 
c15ae67dd97c53b8c4f5a2af4bb435b0b2712869	nan	0	CRASH	 File "/Users/gobus/Desktop/main/projects/NEUROHACK/AutoNeuro/train.py", line 1 ```python ^ SyntaxError: invalid syntax 
c15ae67dd97c53b8c4f5a2af4bb435b0b2712869	0.437184	0	DISCARD	[train] Val R² score: 0.437184 
c15ae67dd97c53b8c4f5a2af4bb435b0b2712869	0.410035	0	DISCARD	[train] Val R² score: 0.410035 
c15ae67dd97c53b8c4f5a2af4bb435b0b2712869	nan	0	CRASH	 File "/Users/gobus/Desktop/main/projects/NEUROHACK/AutoNeuro/train.py", line 1 ```python ^ SyntaxError: invalid syntax 
c15ae67dd97c53b8c4f5a2af4bb435b0b2712869	0.388067	0	DISCARD	[train] Val R² score: 0.388067 
c15ae67dd97c53b8c4f5a2af4bb435b0b2712869	0.360834	0	DISCARD	[train] Val R² score: 0.360834 
c15ae67dd97c53b8c4f5a2af4bb435b0b2712869	nan	0	CRASH	 File "/Users/gobus/Desktop/main/projects/NEUROHACK/AutoNeuro/train.py", line 1 ```python ^ SyntaxError: invalid syntax 
c15ae67dd97c53b8c4f5a2af4bb435b0b2712869	0.378395	0	DISCARD	[train] Val R² score: 0.378395 
c15ae67dd97c53b8c4f5a2af4bb435b0b2712869	0.410035	0	KEEP	[train] Val R² score: 0.410035 
8ac0923cae02d6b16bd119abb946f0c036072a40	nan	0	CRASH	 File "/Users/gobus/Desktop/main/projects/NEUROHACK/AutoNeuro/train.py", line 1 ```python ^ SyntaxError: invalid syntax 
8ac0923cae02d6b16bd119abb946f0c036072a40	0.437184	0	DISCARD	[train] Val R² score: 0.437184 
8ac0923cae02d6b16bd119abb946f0c036072a40	nan	0	CRASH	 File "/Users/gobus/Desktop/main/projects/NEUROHACK/AutoNeuro/train.py", line 1 ```python ^ SyntaxError: invalid syntax 
8ac0923cae02d6b16bd119abb946f0c036072a40	0.385559	0	DISCARD	[train] Val R² score: 0.385559 
8ac0923cae02d6b16bd119abb946f0c036072a40	0.410035	0	KEEP	[train] Val R² score: 0.410035 
ad0cded3da28c01eba3cdc4b901cd37e58650ef8	0.410035	0	DISCARD	[train] Val R² score: 0.410035 
ad0cded3da28c01eba3cdc4b901cd37e58650ef8	0.410035	0	DISCARD	[train] Val R² score: 0.410035 
ad0cded3da28c01eba3cdc4b901cd37e58650ef8	0.410035	0	DISCARD	[train] Val R² score: 0.410035 
ad0cded3da28c01eba3cdc4b901cd37e58650ef8	nan	0	CRASH	 File "/Users/gobus/Desktop/main/projects/NEUROHACK/AutoNeuro/train.py", line 1 ```python ^ SyntaxError: invalid syntax 
ad0cded3da28c01eba3cdc4b901cd37e58650ef8	0.454147	0	DISCARD	[train] Val R² score: 0.454147 
ad0cded3da28c01eba3cdc4b901cd37e58650ef8	0.350063	0	DISCARD	[train] Val R² score: 0.350063 
ad0cded3da28c01eba3cdc4b901cd37e58650ef8	0.388067	0	KEEP	[train] Val R² score: 0.388067 
45da2d577b6e00409da0e1d09d0d087bd1366dd1	0.454147	0	KEEP	[train] Val R² score: 0.454147 
fcce0f2e89b115b3342c987d1542ab488e4b07be	nan	0	CRASH	 File "/Users/gobus/Desktop/main/projects/NEUROHACK/AutoNeuro/train.py", line 1 ```python ^ SyntaxError: invalid syntax 
fcce0f2e89b115b3342c987d1542ab488e4b07be	0.451445	0	DISCARD	[train] Val R² score: 0.451445 
fcce0f2e89b115b3342c987d1542ab488e4b07be	nan	0	CRASH	 File "/Users/gobus/Desktop/main/projects/NEUROHACK/AutoNeuro/train.py", line 1 ```python ^ SyntaxError: invalid syntax 
fcce0f2e89b115b3342c987d1542ab488e4b07be	0.452979	0	DISCARD	[train] Val R² score: 0.452979 
fcce0f2e89b115b3342c987d1542ab488e4b07be	0.452979	0	DISCARD	[train] Val R² score: 0.452979 
fcce0f2e89b115b3342c987d1542ab488e4b07be	0.452979	0	DISCARD	[train] Val R² score: 0.452979 
fcce0f2e89b115b3342c987d1542ab488e4b07be	0.452979	0	DISCARD	[train] Val R² score: 0.452979 
